{
  "hatch_particles": "minecraft:end_rod",
  "accessories": ["middle_tail_scales"],
  "abilities": [
    {
      "ability": "gem_guard",
      "chance": 0.5
    },
    {
      "ability": "crystal_harmony",
      "chance": 0.5
    }
  ],
  "primary_color": "10975729",
  "secondary_color": "16698599",
  "ambient_sound": "dmr:entity.dragon.breathe",
  "growth_time": 72000,
  "hatch_time": 12000,
  "loot_tables": [
    {
      "table": "minecraft:chests/stronghold_library",
      "chance": 0.15,
      "min": 1,
      "max": 1
    }
  ]
}
