{
  "abilities": [
    "nature_blessing",
    "camouflage"
  ],
  "habitats": [
    {
      "type": "nearby_blocks",
      "block_tag": "dmr:forest_dragon_habitat_blocks"
    },
    {
      "type": "biome",
      "biome_tag": "minecraft:is_jungle"
    },
    {
      "type": "biome",
      "biome_tag": "minecraft:is_forest"
    }
  ],
  "hatch_particles": "minecraft:happy_villager",
  "primary_color": "54a00",
  "secondary_color": "a9600",
  "loot_tables": [
    {
      "table": "minecraft:chests/jungle_temple",
      "chance": 0.3,
      "min": 1,
      "max": 1
    }
  ]
}