{
  "hatch_particles": "minecraft:end_rod",
  "accessories": ["middle_tail_scales"],
  "habitats": [
    {
      "type": "nearby_blocks",
      "block_tag": "dmr:amethyst_dragon_habitat_blocks"
    }
  ],
  "abilities": [
    {
      "ability": "#common_abilities"
    },
    {
      "ability": "gem_guard",
      "chance": 0.5
    },
    {
      "ability": "crystal_harmony",
      "chance": 0.5
    }
  ],
  "primary_color": "A779F1",
  "secondary_color": "FECCE7",
  "ambient_sound": "dmr:entity.dragon.breathe",
  "breath_type": "amethyst",
  "inventory_texture": "textures/block/amethyst_block.png",
  "loot_tables": [
    {
      "table": "minecraft:chests/stronghold_library",
      "chance": 0.1,
      "min": 1,
      "max": 1
    }
  ]
}
