{
  "habitats": [
    {
      "type": "in_fluid",
      "fluid_tag": "minecraft:water",
      "point_multiplier": 3.0
    },
    {
      "type": "nearby_blocks",
      "block_tag": "dmr:water_dragon_habitat_blocks"
    },
    {
      "type": "biome",
      "biome_tag": "minecraft:is_ocean"
    },
    {
      "type": "biome",
      "biome_tag": "minecraft:is_river"
    },
    {
      "type": "biome",
      "biome_tag": "minecraft:is_beach"
    }
  ],
  "hatch_particles": "minecraft:dripping_water",
  "immunities": ["drown"],
  "abilities": ["aquatic_grace", "swift_swim"],
  "primary_color": "62ff",
  "secondary_color": "5999ff",
  "loot_tables": [
    {
      "table": "minecraft:chests/buried_treasure",
      "chance": 0.175,
      "min": 1,
      "max": 1
    }
  ],
  "accessories": ["tail_horns", "leg_fins"]
}
