{
  "attributes": {
    "minecraft:generic.armor": 8.0
  },
  "abilities": ["infernal_pact", "fire_proof"],
  "habitats": [
    {
      "type": "nearby_blocks",
      "block_tag": "dmr:nether_dragon_habitat_blocks"
    },
    {
      "type": "biome",
      "biome_tag": "minecraft:is_nether",
      "points": 3
    }
  ],
  "hatch_particles": "minecraft:soul_fire_flame",
  "immunities": ["inFire", "onFire", "lava", "hotFloor"],
  "primary_color": "912400",
  "secondary_color": "2e0b00",
  "loot_tables": [
    {
      "table": "minecraft:chests/bastion_treasure",
      "chance": 0.35,
      "min": 1,
      "max": 1
    },
    {
      "table": "minecraft:chests/nether_bridge",
      "chance": 0.15,
      "min": 1,
      "max": 1
    }
  ]
}
