{
  "hatch_particles": "minecraft:sculk_charge_pop",
  "accessories": ["tail_horns"],
  "habitats": [
    {
      "type": "biome",
      "biome_tag": "minecraft:deep_dark"
    },
    {
      "type": "nearby_blocks",
      "block_tag": "dmr:sculk_dragon_habitat_blocks"
    }
  ],
  "abilities": ["echo_sense"],
  "primary_color": "D1216",
  "secondary_color": "19295",
  "ambient_sound": "dmr:entity.dragon.breathe",
  "loot_tables": [
    {
      "table": "minecraft:chests/ancient_city",
      "chance": 0.15,
      "min": 1,
      "max": 1
    }
  ]
}
