{
  "attributes": {
    "minecraft:generic.max_health": 75.0
  },
  "habitats": [
    {
      "type": "dragon_breath"
    },
    {
      "type": "biome",
      "biome_tag": "minecraft:is_end"
    },
    {
      "type": "nearby_blocks",
      "block_tag": "dmr:end_dragon_habitat_blocks"
    }
  ],
  "abilities": ["ender_cloak", "void_walker"],
  "hatch_particles": "minecraft:portal",
  "immunities": ["dragonBreath"],
  "primary_color": "161616",
  "secondary_color": "ff63e8",
  "accessories": ["second_horns"],
  "loot_tables": [
    {
      "table": "minecraft:chests/stronghold_corridor",
      "chance": 0.1,
      "min": 1,
      "max": 1
    }
  ]
}
