{
  "abilities": [
    "frost_walker",
    "frost_aura"
  ],
  "habitats": [
    {
      "type": "nearby_blocks",
      "block_tag": "dmr:ice_dragon_habitat_blocks"
    },
    {
      "type": "biome",
      "biome_tag": "forge:is_cold/overworld"
    }
  ],
  "hatch_particles": "minecraft:snowflake",
  "immunities": [
    "drown",
    "freeze"
  ],
  "primary_color": "ffffff",
  "secondary_color": "e1ff",
  "loot_tables": [
    {
      "table": "minecraft:chests/igloo_chest",
      "chance": 0.2,
      "min": 1,
      "max": 1
    }
  ]
}